question_id,question_type,question,ideal_answer,baseline_success,baseline_time,baseline_answer,baseline_input_tokens,baseline_output_tokens,baseline_cost_usd,togomcp_success,togomcp_time,togomcp_answer,togomcp_input_tokens,togomcp_output_tokens,togomcp_cost_usd,total_cost_usd,tools_used,baseline_recall,baseline_precision,baseline_repetition,baseline_readability,baseline_total_score,baseline_evaluation_explanation,togomcp_recall,togomcp_precision,togomcp_repetition,togomcp_readability,togomcp_total_score,togomcp_evaluation_explanation
question_010,choice,"Which parent disease category of systemic lupus erythematosus has the most diseases with confirmed MeSH TopicalDescriptor mappings?

Choose one of the following options:
  - immune system disorder
  - autoimmune disease
  - connective tissue disorder
  - rheumatic disorder","Immune system disorder (MONDO:0005046) has the most diseases with confirmed MeSH TopicalDescriptor mappings among the four parent categories of systemic lupus erythematosus, with 248 confirmed MeSH TopicalDescriptors across its disease subclasses. This substantially exceeds connective tissue disorder (134 TopicalDescriptors), autoimmune disease (61 TopicalDescriptors), and rheumatic disorder (39 TopicalDescriptors). The counts reflect confirmed joins with the MeSH RDF graph restricted to meshv:TopicalDescriptor entries (i.e., canonical MeSH headings used for indexing); MONDO cross-references to MeSH supplementary concept records (MESH:C...) are excluded. The four categories are not mutually exclusive: immune system disorder is the broadest and contains the other three as subcategories, so their diseases are counted within it as well — the sum across categories (482) exceeds the 346 unique diseases with TopicalDescriptor mappings due to this intentional overlap in the ontology hierarchy. The higher absolute count for immune system disorder reflects its greater scope rather than a higher per-disease mapping rate, since autoimmune disease and rheumatic disorder actually have proportionally good coverage relative to their size.
",True,6.61,"The correct answer is **autoimmune disease**.

Systemic lupus erythematosus (SLE) is classified under multiple parent disease categories in medical terminology hierarchies, including autoimmune disease, connective tissue disorder, immune system disorder, and rheumatic disorder. Among these categories, autoimmune disease encompasses the largest number of diseases with confirmed MeSH (Medical Subject Headings) TopicalDescriptor mappings. The autoimmune disease category includes dozens of well-characterized conditions such as rheumatoid arthritis, type 1 diabetes, multiple sclerosis, Sjögren's syndrome, systemic sclerosis, inflammatory bowel diseases, autoimmune thyroid diseases, and many others, each with established MeSH descriptors. While connective tissue disorders and rheumatic disorders are also substantial categories, they are more limited in scope compared to the broader autoimmune disease classification, which spans multiple organ systems and includes both systemic and organ-specific conditions. Immune system disorders represents an even broader category but includes many non-autoimmune conditions (like immunodeficiencies and hypersensitivity reactions) that may not all have the same level of MeSH TopicalDescriptor documentation as the more specifically defined autoimmune diseases.",242,273,0.004821,True,72.78,"**Immune system disorder**

Immune system disorder (MONDO:0005046) has the most diseases with confirmed MeSH TopicalDescriptor mappings, with 510 diseases, compared to autoimmune disease (85 diseases), connective tissue disorder (246 diseases), and rheumatic disorder (98 diseases). This is because immune system disorder represents the broadest parent category in the MONDO disease ontology hierarchy, encompassing not only autoimmune diseases but also a wide range of other immune-related conditions including immunodeficiencies, hypersensitivity reactions, and immune proliferative disorders, all of which are well-represented in the MeSH vocabulary with TopicalDescriptor mappings.",207,3340,0.16439515,0.169216,"ToolSearch, mcp__togomcp__search_mesh_descriptor, ToolSearch, mcp__ols__search, mcp__ols__getAncestors, mcp__togomcp__run_sparql, mcp__togomcp__run_sparql, mcp__togomcp__run_sparql, mcp__togomcp__run_sparql, mcp__togomcp__run_sparql",1,3,4,4,12,"Selects autoimmune disease, which is incorrect; the ideal answer is immune system disorder. Reasoning is plausible but the choice is wrong.",5,5,5,5,20,Correctly identifies immune system disorder as the answer with rationale about MONDO hierarchy; counts (510) differ from ideal (248) but ranking is correct.
question_011,factoid,How many distinct PubChem compounds participate in chlorophyll and bacteriochlorophyll biosynthesis reactions documented in Rhea?,"Chlorophyll and bacteriochlorophyll biosynthesis involves the enzymatic conversion of tetrapyrrole precursors into photosynthetically active pigments. The Rhea database documents these biochemical reactions by linking them to chemical entities in ChEBI. Querying Rhea reactions whose equation text mentions ""chlorophyll"" or ""bacteriochlorophyll"" and extracting their associated ChEBI compound identifiers (via the rh:chebi property) yields 64 unique ChEBI chemical entities involved in these pathways. These ChEBI classes serve as type annotations for PubChem compound entries (via rdf:type assertions), enabling cross-database integration. Filtering for PubChem compounds (those with URIs starting with ""http://rdf.ncbi.nlm.nih.gov/pubchem/compound/"") that are typed by any of these 64 ChEBI classes yields 24 distinct compounds. These include central pathway intermediates such as protoporphyrinogen IX, Mg-protoporphyrin IX, and various chlorophyllide derivatives, as well as cofactors like NADPH, ATP, and S-adenosyl-L-methionine. The substantially smaller number of PubChem entries relative to ChEBI classes reflects the fact that many highly specific tetrapyrrole intermediates and bacteriochlorophyll precursors, though well-defined in ChEBI, do not yet have curated entries in PubChem.
",True,5.96,"I cannot provide a specific number for how many distinct PubChem compounds participate in chlorophyll and bacteriochlorophyll biosynthesis reactions documented in Rhea, as this requires querying the Rhea database directly to count unique PubChem compound identifiers associated with these specific metabolic pathways. Rhea is a curated database of biochemical reactions that uses cross-references to other databases including PubChem for compound identification, and the exact count would depend on the current state of the database, which is regularly updated with new annotations and cross-references. To obtain this information, one would need to search Rhea for reactions annotated with terms related to chlorophyll biosynthesis (such as ""chlorophyll biosynthetic process"" or ""bacteriochlorophyll biosynthetic process""), extract all associated PubChem compound identifiers from those reactions, and count the distinct identifiers. Without access to perform such a database query, I cannot provide the specific numerical answer requested.",333,216,0.004239,True,286.83,"Twenty distinct PubChem compounds participate in chlorophyll and bacteriochlorophyll biosynthesis reactions documented in Rhea. These compounds include essential metabolic cofactors (NAD+, NADP+, NADPH, NADH, ATP, and ADP), small molecules (water, dioxygen, carbon dioxide, and methanol), phosphate-containing compounds (diphosphate, phosphate, and geranylgeranyl diphosphate), S-adenosyl-L-methionine as a methyl donor, and critical biosynthetic intermediates such as Mg-protoporphyrin IX 13-monomethyl ester, protochlorophyllide a, 3,8-divinyl protochlorophyllide a, chlorophyllide a, and 3,8-divinyl chlorophyllide a. The remaining participants in these biosynthetic pathways—primarily various bacteriochlorophyllide species and specialized chlorophyll intermediates—lack corresponding PubChem entries, reflecting their status as organism-specific metabolites with limited representation in general chemical databases.",643,14375,0.6444040500000001,0.648643,"ToolSearch, mcp__togomcp__search_rhea_entity, mcp__togomcp__search_rhea_entity, mcp__togomcp__search_rhea_entity, mcp__togomcp__search_rhea_entity, mcp__togomcp__run_sparql, mcp__togomcp__run_sparql, mcp__togomcp__run_sparql, mcp__togomcp__run_sparql, mcp__togomcp__run_sparql, mcp__togomcp__run_sparql, mcp__togomcp__run_sparql, mcp__togomcp__run_sparql, ToolSearch, mcp__togomcp__togoid_convertId, mcp__togomcp__run_sparql, mcp__togomcp__run_sparql, mcp__togomcp__run_sparql, mcp__togomcp__run_sparql, mcp__togomcp__togoid_convertId, mcp__togomcp__run_sparql, mcp__togomcp__run_sparql, mcp__togomcp__run_sparql, mcp__togomcp__run_sparql, mcp__togomcp__run_sparql, mcp__togomcp__run_sparql, mcp__togomcp__togoid_convertId, mcp__togomcp__run_sparql, mcp__togomcp__run_sparql, mcp__togomcp__run_sparql",1,2,4,4,11,"Refuses to answer with a number, only describes how to perform the query; missing the entire quantitative answer.",4,5,5,5,19,"Provides 20 (close to ideal 24) with appropriate examples like NADPH, ATP, SAM, and chlorophyll intermediates; mostly aligned but slightly low count."
question_012,yes_no,Does human decorin (UniProt:P07585) have documented glycosylation sites in the GlyCosmos database?,"Yes, human decorin (UniProt:P07585) has documented glycosylation sites in the GlyCosmos database. Decorin is a small leucine-rich proteoglycan bearing glycosylation at six distinct amino acid positions: 34, 115, 211, 255, 262, and 303. The database records 286 total glycosylation site entries for decorin, reflecting the multiple glycan structures (glycoforms) annotated at individual positions — position 211 alone carries 132 distinct glycoform entries and position 262 carries 121, indicating extensive N-glycan microheterogeneity at these asparagine residues. The site at position 34 corresponds to the canonical glycosaminoglycan (chondroitin/dermatan sulfate) attachment serine characteristic of the proteoglycan core protein. This rich glycosylation complexity is consistent with decorin's biological roles in extracellular matrix organization, collagen fibrillogenesis, and TGF-β sequestration, where the glycan chains modulate protein–protein interactions and tissue hydration.
",True,6.35,"I cannot access external databases like GlyCosmos to verify current documentation of glycosylation sites for human decorin (UniProt:P07585). However, based on established knowledge, human decorin is a small leucine-rich proteoglycan that contains well-characterized post-translational modifications. The protein has a single glycosaminoglycan (GAG) attachment site at serine-34 in the N-terminal region, where a chondroitin sulfate or dermatan sulfate chain is typically attached. Additionally, decorin contains N-glycosylation sites, with asparagine residues at positions 211, 262, and 303 being documented glycosylation sites in the protein core. These modifications are critical for decorin's biological functions, including collagen fibril assembly, growth factor binding, and interactions with the extracellular matrix. To confirm whether these specific sites are currently documented in the GlyCosmos database and to identify any additional glycosylation sites that may have been characterized more recently, direct consultation of the GlyCosmos database would be necessary.",332,242,0.004626,True,80.72,"Yes, human decorin (UniProt:P07585) has documented glycosylation sites in the GlyCosmos database. The database contains four glycosylation sites at positions 34, 211, 262, and 303 of the protein sequence. All four sites are characterized as O-linked glycosaminoglycan modifications on serine residues, with the attachment initiated by xylose, which is consistent with decorin's known function as a proteoglycan carrying chondroitin sulfate or dermatan sulfate glycosaminoglycan chains in the extracellular matrix.",285,4039,0.1843146,0.188941,"ToolSearch, mcp__togomcp__run_sparql, mcp__togomcp__run_sparql, mcp__togomcp__run_sparql, mcp__togomcp__run_sparql, mcp__togomcp__run_sparql, mcp__togomcp__run_sparql, mcp__togomcp__run_sparql, mcp__togomcp__run_sparql, mcp__togomcp__run_sparql, mcp__togomcp__run_sparql, mcp__togomcp__run_sparql",2,3,4,4,13,"Hedges on database access but mentions sites 34, 211, 262, 303 which match a subset of the ideal; misses 115 and 255 and the 286 entry count.",3,5,5,5,18,"Correctly answers yes with 4 sites (34, 211, 262, 303) but misses positions 115 and 255 from ideal and the 286-entry total; otherwise concise and accurate."
question_013,list,"Which 5 genes have the most documented pathogenic or likely pathogenic ClinVar variants for Joubert syndrome, ranked by variant count?","Integrating NANDO rare disease registry data, MedGen medical genetics concepts, and ClinVar variant data across all 51 Joubert syndrome MedGen concepts reveals 190 distinct genes with documented pathogenic or likely pathogenic variants. The five most heavily annotated are CEP290 (529 current P/LP variants), RPGRIP1L (255), CC2D2A (242), AHI1 (222), and TMEM67 (149). CEP290 encodes a centrosomal protein localised to primary cilia and is mutated across numerous ciliopathy subtypes including Joubert syndrome types 5 and 14, Bardet-Biedl syndrome, and nephronophthisis. RPGRIP1L (Joubert syndrome 7) and CC2D2A (Joubert syndrome 9) encode transition zone components critical for ciliary gate integrity, while AHI1 (jouberin, Joubert syndrome 3) mediates cerebellar and cortical development. TMEM67 (meckelin, Joubert syndrome 6) is a receptor-like transmembrane protein required for primary cilium formation. The high allelic burden in these genes reflects their role as major disease loci across multiple Joubert syndrome subtypes, the diagnostic importance of comprehensive multi-subtype variant cataloguing, and the evolutionary conservation of ciliary transition zone architecture.
",True,6.01,"I cannot provide a definitive ranking of the top 5 genes by exact pathogenic/likely pathogenic ClinVar variant counts for Joubert syndrome based solely on my training knowledge. While I know that Joubert syndrome is associated with numerous genes involved in ciliary function and structure, including CEP290, TMEM67, CC2D2A, AHI1, NPHP1, RPGRIP1L, TMEM216, and others, I do not have access to the current ClinVar database statistics that would be required to accurately count and rank variants for each gene. ClinVar is a continuously updated database, and variant counts change regularly as new submissions are added and classifications are revised. To obtain accurate current rankings by pathogenic variant count, direct querying of the ClinVar database would be necessary, which I cannot perform.",333,185,0.003774,True,565.85,"Based on my analysis of ClinVar data for pathogenic and likely pathogenic variants associated with Joubert syndrome, RPGRIP1L shows the highest variant count with 125 documented variants among a sample of 253 analyzed variants, followed by AHI1 with 44 variants, CC2D2A with 31 variants, KIAA0586 with 19 variants, and CEP290 with 17 variants. RPGRIP1L accounts for approximately 49% of all pathogenic or likely pathogenic variants in the analyzed sample, establishing it as the predominant gene associated with Joubert syndrome pathogenic variation. The remaining four genes (AHI1, CC2D2A, KIAA0586, and CEP290) collectively account for the majority of the remaining documented pathogenic variants, with AHI1 being the second most frequently mutated gene at roughly 17% of the sample.",810,16049,1.1705612999999997,1.174335,"ToolSearch, mcp__togomcp__ncbi_esearch, mcp__togomcp__ncbi_esearch, mcp__togomcp__ncbi_esummary, Read, Bash, Bash, Bash, Bash, Bash, Agent, ToolSearch, mcp__togomcp__ncbi_esummary, Read, Bash, Bash, mcp__togomcp__ncbi_esearch, mcp__togomcp__ncbi_esummary, ToolSearch, mcp__pubmed__search_articles, mcp__pubmed__search_articles, mcp__togomcp__ncbi_esummary, ToolSearch, mcp__togomcp__run_sparql, mcp__togomcp__run_sparql, mcp__togomcp__run_sparql, ToolSearch, mcp__togomcp__search_uniprot_entity, mcp__pubmed__search_articles, mcp__pubmed__search_articles, mcp__togomcp__ncbi_esummary, Agent, ToolSearch, mcp__togomcp__ncbi_esearch, mcp__togomcp__ncbi_esummary, mcp__togomcp__ncbi_esummary, mcp__togomcp__ncbi_esummary, mcp__togomcp__ncbi_esummary, mcp__togomcp__ncbi_esummary, Write, Bash, Bash, Bash, Bash, Bash, Bash, Bash, Bash, Bash, mcp__togomcp__ncbi_esummary, Read",1,3,4,4,12,Refuses to provide ranked counts and lists only candidate genes without ranking; misses the entire ranked list and counts.,2,3,4,4,13,"Provides ranked list but order is wrong (RPGRIP1L vs ideal's CEP290 first), counts are very different from ideal, and includes KIAA0586 instead of TMEM67."
question_014,factoid,How many reviewed UniProt proteins are annotated with the GO molecular function 'hormone activity' or any of its descendant terms?,"There are 2,453 reviewed proteins annotated with hormone activity across all organisms in UniProt. This count encompasses proteins with the GO molecular function 'hormone activity' (GO:0005179) and all 19 descendant terms representing specific hormone types, including growth hormone activity, digestive hormone activity, neuropeptide hormone activity, and insect-specific hormone activities such as prothoracicotrophic hormone and ecdysis-triggering hormone. The taxonomic distribution reveals that hormone proteins are predominantly found in mammals, with Mus musculus (138 proteins), Homo sapiens (134 proteins), and Rattus norvegicus (123 proteins) representing the top three species. Significant representation is also observed in other vertebrates (83 proteins in Bos taurus, 67 in Sus scrofa), insects (39 in Drosophila melanogaster, 37 in Bombyx mori), and notably in the plant Arabidopsis thaliana (57 proteins), reflecting the evolutionary conservation and diversification of hormonal signaling systems across eukaryotes.
",True,4.63,"I do not have access to real-time database queries or the ability to count specific annotations in UniProt. The number of reviewed UniProt proteins annotated with the GO molecular function 'hormone activity' (GO:0005179) or its descendant terms changes regularly as new proteins are reviewed and annotations are updated. To obtain the current count, you would need to directly query the UniProt database using their search interface with the appropriate GO term filters, or use programmatic access through their API. Historical counts from specific time points may exist in published literature, but these would not reflect the current state of the database.",331,131,0.002958,True,138.46,"There are 2,453 reviewed UniProt proteins annotated with the GO molecular function term 'hormone activity' (GO:0005179) or any of its 19 descendant terms. The term 'hormone activity' encompasses a diverse family of more specific molecular functions including growth hormone activity, neuropeptide hormone activity, neurohypophyseal hormone activity, and various other hormone subtypes such as follicle-stimulating hormone, melanocyte-stimulating hormone, thyrotropin-releasing hormone, and corticotropin-releasing hormone activities. Of these 2,453 proteins, 1,659 are directly annotated with the parent term GO:0005179, while the remaining proteins carry annotations to one or more of the specialized descendant terms that define specific classes of hormone activity.",186,3084,0.17886975,0.181828,"ToolSearch, mcp__togomcp__run_sparql, ToolSearch, mcp__ols__search, mcp__ols__getDescendants, mcp__togomcp__run_sparql, mcp__togomcp__run_sparql",1,2,4,4,11,Refuses to answer; only states the number changes regularly. Misses the entire factoid count.,5,5,5,5,20,Exactly matches the ideal (2453) and describes descendant terms and direct vs descendant breakdown well.
