question_id,question_type,question,ideal_answer,baseline_success,baseline_time,baseline_answer,baseline_input_tokens,baseline_output_tokens,baseline_cost_usd,togomcp_success,togomcp_time,togomcp_answer,togomcp_input_tokens,togomcp_output_tokens,togomcp_cost_usd,total_cost_usd,tools_used,baseline_recall,baseline_precision,baseline_repetition,baseline_readability,baseline_total_score,baseline_evaluation_explanation,togomcp_recall,togomcp_precision,togomcp_repetition,togomcp_readability,togomcp_total_score,togomcp_evaluation_explanation
question_001,yes_no,Does the HSPB1 gene have pathogenic variants documented in ClinVar for Charcot-Marie-Tooth disease?,"Yes, HSPB1 (heat shock protein family B (small) member 1, Gene ID 3315) has multiple pathogenic and likely pathogenic variants documented in ClinVar that are specifically linked to Charcot-Marie-Tooth disease type 2F (CMT2F; MedGen C1847823), the HSPB1-associated axonal subtype of CMT. The exact count depends on the database snapshot; the RDF portal query returned 20 current records at time of query, while the live NCBI ClinVar release contains ≥66 such variants. Variants include missense substitutions affecting functionally critical residues in the alpha-crystallin domain (e.g., c.379C>T p.Arg127Trp, c.404C>T p.Ser135Phe, c.406C>T p.Arg136Trp, c.418C>G p.Arg140Gly, c.545C>T p.Pro182Leu), as well as frameshift and nonsense variants (e.g., c.109dup p.Arg37fs (Likely pathogenic), c.532G>T p.Glu178Ter (Likely pathogenic)). Several large deletions at the HSPB1 locus on chromosome 7q11.23 also appear in the dataset. CMT2F is an autosomal dominant axonal peripheral sensorimotor neuropathy characterised by distal muscle weakness, sensory loss, and reduced tendon reflexes with onset ranging from the first to sixth decade.
",True,5.49,"Yes, the HSPB1 gene has pathogenic variants documented in ClinVar for Charcot-Marie-Tooth disease. HSPB1 (Heat Shock Protein Family B Member 1) encodes the small heat shock protein HSP27, and mutations in this gene cause Charcot-Marie-Tooth disease type 2F (CMT2F) and distal hereditary motor neuropathy type 2B (dHMN2B). ClinVar contains multiple pathogenic and likely pathogenic variants in HSPB1 associated with these axonal neuropathy phenotypes, which are inherited in an autosomal dominant pattern. These variants typically result in missense mutations that affect the protein's ability to properly fold and stabilize cytoskeletal proteins, particularly in peripheral nerve axons. The documented pathogenic variants in ClinVar include mutations affecting critical functional domains of the HSP27 protein, leading to progressive motor and sensory neuropathy characteristic of CMT disease.",333,223,0.004344,True,56.3,"Yes. The HSPB1 gene has 68 pathogenic or likely pathogenic variants documented in ClinVar for Charcot-Marie-Tooth disease, specifically the axonal type 2F subtype. These include frameshift variants such as c.472del (p.Ser158fs) and c.245_246insT (p.Ser83fs) classified as pathogenic, as well as missense variants like c.116C>G (p.Pro39Arg) classified as likely pathogenic.",174,2010,0.24481655,0.249161,"ToolSearch, mcp__togomcp__ncbi_esearch, mcp__togomcp__ncbi_esummary, Read, mcp__togomcp__ncbi_esearch, mcp__togomcp__ncbi_esummary",3,5,4,4,16,"Confirms yes and identifies CMT2F but lacks specific variant examples and any count, missing key quantitative content from ideal.",4,5,5,5,19,Provides count (68) and specific variant examples; concise and well-structured though lacks the missense Arg127Trp/Arg136Trp examples in ideal.
question_002,factoid,How many reviewed human proteins are annotated with chemotaxis-related GO biological process terms?,"There are 326 reviewed human proteins annotated with chemotaxis-related GO biological process terms. These proteins span 70 distinct chemotaxis-related GO terms, including the parent term ""chemotaxis"" (GO:0006935) and 69 descendant terms covering cell-type-specific chemotaxis (such as leukocyte, neutrophil, macrophage, and lymphocyte chemotaxis), directional responses (positive and negative chemotaxis, chemoattraction and chemorepulsion), and specialized forms like axon guidance chemotaxis and energy taxis. The annotations encompass proteins involved in immune cell recruitment, neural development, and microbial motility. Major functional categories include chemokine receptors, integrins, and signaling molecules that regulate directed cell migration in response to chemical gradients.
",True,6.44,"I cannot provide a specific numerical answer to this question as it requires accessing current database information from resources like UniProt and the Gene Ontology, which contain regularly updated annotations that I don't have real-time access to. The number of reviewed human proteins annotated with chemotaxis-related GO biological process terms would depend on the current state of protein curation in UniProt/Swiss-Prot (the reviewed section of UniProt) and would include proteins associated with GO terms such as ""chemotaxis"" (GO:0006935) and its child terms like ""leukocyte chemotaxis,"" ""neutrophil chemotaxis,"" or ""chemotaxis to cAMP."" This number changes over time as new proteins are characterized, reviewed, and annotated, and as the Gene Ontology itself evolves with new term definitions and relationships. To obtain an accurate current count, one would need to query the UniProt database directly, filtering for reviewed human proteins with annotations to chemotaxis-related biological process terms.",322,220,0.004266,True,86.47,"There are 463 reviewed human proteins annotated with chemotaxis-related GO biological process terms. These proteins include members of the C-C motif chemokine family (such as CCL1, CCL4, CCL7, CCL16, and CCL26), C-X-C motif chemokine family (including CXCL3, CXCL13, and CXCL17), and various other proteins involved in directed cell migration processes such as vascular endothelial growth factors, death-associated protein kinases, matrix metalloproteinases, and immune-related signaling proteins.",264,3075,0.1498046,0.154071,"ToolSearch, mcp__togomcp__search_uniprot_entity, Read, Read, Bash, Bash, Bash, Bash, Bash, mcp__togomcp__search_uniprot_entity, Bash",1,2,4,4,11,"Refuses to answer with a count; provides only generic context about UniProt and GO without addressing the question, missing all key quantitative information.",2,4,5,5,16,Provides a numerical answer (463) that contradicts the ideal (326); lists chemokine examples but the core figure is incorrect.
question_003,factoid,How many reviewed human proteins annotated with at least one autophagy biological process term (GO:0006914 or its descendants) have at least one approved catalytic reaction?,"Among the 284 reviewed human proteins annotated with autophagy-related biological process terms (GO:0006914 and its 25 descendant terms spanning macroautophagy, microautophagy, mitophagy, pexophagy, reticulophagy, and other selective autophagy subtypes), 65 have at least one approved catalytic reaction. These 65 proteins represent approximately 23% of human autophagy proteins and encompass diverse enzyme classes: serine/threonine kinases including the AMPK alpha subunits (PRKAA1, PRKAA2) that phosphorylate autophagy regulators; cysteine proteases such as ATG4A and ATG4B that cleave LC3 family members from autophagosomal membranes; ATPases including the polyamine transporter ATP13A2 that moves spermine and spermidine across lysosomal membranes; phospholipid scramblases ATG2A and ATG2B that transfer lipids to expanding phagophores; and tyrosine kinases such as ABL1 that phosphorylate autophagy substrates. All reactions linked to these proteins are chemically balanced and approved, confirming that their enzymatic mechanisms are precisely documented at the atomic level.",True,8.96,"I cannot provide a precise numerical answer to this question as it requires real-time access to specific databases - namely UniProt (for reviewed human proteins), Gene Ontology (GO) annotations (for autophagy-related terms GO:0006914 and descendants), and catalytic reaction databases like Rhea or the Enzyme Commission. These databases are continuously updated with new protein annotations, GO term assignments, and characterized enzymatic activities, meaning any specific count would be time-dependent and requires direct database queries that I cannot perform.

To answer this question accurately, one would need to: (1) query UniProt for all reviewed (Swiss-Prot) human proteins annotated with GO:0006914 (autophagy) or any of its child terms in the GO hierarchy, (2) identify which of these proteins have at least one approved catalytic reaction annotation (typically indicated by EC numbers or Rhea reaction identifiers in UniProt entries), and (3) count the intersection of these two sets. The autophagy process involves numerous proteins with catalytic activities, including kinases like ULK1, E1/E2/E3 enzymes in the ubiquitin-like conjugation systems (ATG7, ATG3, ATG12), lipid-modifying enzymes, and proteases, but determining the exact count requires direct database access that exceeds my training knowledge capabilities.",340,303,0.005565,True,122.72,"Sixty-five reviewed human proteins meet both criteria. These proteins are annotated with the autophagy biological process term GO:0006914 or one of its descendant terms in the Gene Ontology hierarchy, and each possesses at least one catalytic activity with a curated reaction from the Rhea database. The proteins span various autophagy-related functions, including core autophagy machinery components such as autophagy-related protein 2 homologs and regulatory kinases like PINK1 that participate in selective autophagy pathways such as mitophagy, as well as numerous other enzymes with kinase, transferase, and hydrolase activities that play roles in autophagy regulation and execution.",285,5125,0.2201271,0.225692,"ToolSearch, mcp__togomcp__run_sparql, mcp__togomcp__run_sparql, mcp__togomcp__run_sparql, mcp__togomcp__run_sparql, mcp__togomcp__run_sparql, mcp__togomcp__run_sparql, mcp__togomcp__run_sparql, mcp__togomcp__run_sparql, mcp__togomcp__run_sparql, mcp__togomcp__run_sparql, mcp__togomcp__run_sparql",1,2,4,4,11,"Refuses to provide the number, only describes how to query the databases; missing the answer (65) entirely.",5,5,5,5,20,Correctly states 65 and describes the autophagy/Rhea integration along with example enzymes; matches the ideal answer well.
question_004,summary,Summarize the distribution of melatonin biosynthesis enzymes across species and characterize their molecular functions and the chemical intermediates involved.,"Melatonin biosynthesis enzymes are distributed across 16 species spanning three kingdoms (Animalia, Plantae, and Fungi), with 33 reviewed proteins in total. Mammals account for 14 proteins across 9 taxa, including two human paralogs (AANAT and ASMT), with coverage extending to mouse, rat, cattle, sheep, macaque, hamster, chimpanzee, and Mus musculus molossinus. Plants contribute 14 proteins from 4 taxa: Arabidopsis thaliana (4 proteins), Oryza sativa subsp. japonica (7 proteins, the most of any single organism), Oryza sativa subsp. indica (1 protein), and Zea mays (2 proteins). Additional representatives include two bird proteins in Gallus gallus, two insect proteins in Drosophila melanogaster, and one fungal protein in Saccharomyces cerevisiae. The pathway proceeds through two enzymatic steps acting on distinct chemical intermediates: first, aralkylamine N-acetyltransferase (AANAT, GO:0004059, a subclass of N-acetyltransferase activity) converts serotonin (CHEBI:28790, C10H12N2O) to N-acetylserotonin (CHEBI:17697, C12H14N2O2); then acetylserotonin O-methyltransferase (ASMT, GO:0017096, a subclass of S-adenosylmethionine-dependent methyltransferase activity) converts N-acetylserotonin to melatonin (CHEBI:16796, C13H16N2O2). Exactly 17 proteins are annotated with AANAT activity and 16 with ASMT activity, with no overlap. This enzymatic conservation across evolutionarily distant taxa — from yeast to plants to mammals — indicates an ancient origin of the two-step melatonin biosynthesis mechanism, with the pathway starting from tryptophan (CHEBI:27897, C11H12N2O2) via serotonin as the upstream precursor.
",True,10.83,"Melatonin biosynthesis enzymes are distributed across diverse taxa including animals, plants, fungi, bacteria, and protists, though the enzymatic pathways and their molecular organization vary considerably among lineages. In vertebrates, the canonical pathway begins with tryptophan hydroxylase (TPH) converting L-tryptophan to 5-hydroxytryptophan, followed by aromatic L-amino acid decarboxylase (AADC) producing serotonin (5-hydroxytryptamine). Arylalkylamine N-acetyltransferase (AANAT) then acetylates serotonin to form N-acetylserotonin, and finally acetylserotonin O-methyltransferase (ASMT, also called hydroxyindole-O-methyltransferase or HIOMT) methylates this intermediate to yield melatonin (N-acetyl-5-methoxytryptophan). AANAT serves as the rate-limiting enzyme in vertebrates and exhibits marked circadian regulation in the pineal gland. In plants, melatonin synthesis follows alternative routes, with tryptophan decarboxylase (TDC) converting tryptophan to tryptamine, which is then hydroxylated by tryptamine 5-hydroxylase (T5H) to serotonin, continuing through similar acetylation and methylation steps, though some plants can also produce melatonin via caffeic acid O-methyltransferase (COMT) acting on 5-hydroxytryptophan. Invertebrates, particularly arthropods, possess AANAT homologs but with different regulatory mechanisms and substrate specificities compared to vertebrates. Bacteria and cyanobacteria synthesize melatonin through pathways that may bypass serotonin entirely, utilizing different enzymatic combinations. The core chemical transformations across species involve hydroxylation, decarboxylation, N-acetylation using acetyl-CoA, and O-methylation using S-adenosyl-L-methionine (SAM) as methyl donor, though the order and specific enzymes catalyzing these reactions exhibit phylogenetic variation.",333,495,0.008424,True,149.08,"Melatonin biosynthesis enzymes are widely distributed across animals, plants, and microorganisms, employing distinct pathways that converge on melatonin production through shared chemical intermediates. In vertebrates, including humans, mice, rats, cattle, sheep, and chickens, the classical pathway proceeds through four enzymatic steps: tryptophan hydroxylase (TPH, EC 1.14.16.4) converts L-tryptophan to 5-hydroxytryptophan; aromatic L-amino acid decarboxylase (AADC, EC 4.1.1.28) decarboxylates this intermediate to serotonin (5-hydroxytryptamine); aralkylamine N-acetyltransferase (AANAT, EC 2.3.1.87) acetylates serotonin to N-acetylserotonin using acetyl-CoA; and acetylserotonin O-methyltransferase (ASMT, EC 2.1.1.4) catalyzes the final O-methylation using S-adenosyl-L-methionine as the methyl donor to produce melatonin. Plants, including rice, Arabidopsis, sweet pepper, and many horticultural species, utilize alternative pathways that begin with tryptophan decarboxylase (TDC, EC 4.1.1.105) producing tryptamine directly from tryptophan, followed by tryptamine 5-hydroxylase (T5H, EC 1.14.14.186) generating serotonin; plants then employ two parallel routes—one mirroring the vertebrate pathway through N-acetylserotonin via SNAT and ASMT, and another producing 5-methoxytryptamine before final conversion to melatonin via caffeic acid O-methyltransferase (COMT). AANAT homologs are also present in insects such as Drosophila melanogaster and the nematode Caenorhabditis elegans, while microorganisms including yeast (Saccharomyces cerevisiae), bacteria (Bacillus, Pseudomonas, Enterobacter species), algae, fungi, and dinoflagellates produce melatonin through pathways that remain less well characterized but appear to involve similar N-acetylation and O-methylation reactions. The enzymes utilize specific cofactors: TPH and T5H require tetrahydrobiopterin and molecular oxygen for hydroxylation; AANAT and SNAT use acetyl-CoA as the acetyl donor; and ASMT employs S-adenosyl-L-methionine as the methyl donor, producing S-adenosyl-L-homocysteine as a byproduct. Plant melatonin biosynthesis occurs in multiple subcellular compartments including chloroplasts and cytoplasm, whereas vertebrate synthesis is primarily cytoplasmic in specialized cells such as pinealocytes, and this phylogenetically ancient pathway demonstrates both remarkable conservation of core chemistry and significant evolutionary divergence in enzymatic strategies across life's major kingdoms.",416,6724,0.33330445,0.341728,"ToolSearch, mcp__pubmed__search_articles, mcp__togomcp__search_uniprot_entity, mcp__togomcp__search_rhea_entity, mcp__togomcp__search_uniprot_entity, mcp__togomcp__search_uniprot_entity, mcp__togomcp__search_uniprot_entity, mcp__togomcp__search_uniprot_entity, ToolSearch, mcp__togomcp__search_uniprot_entity, mcp__togomcp__search_uniprot_entity, mcp__pubmed__get_article_metadata, mcp__togomcp__ncbi_esearch, mcp__togomcp__run_sparql, mcp__pubmed__search_articles, mcp__togomcp__search_uniprot_entity, mcp__pubmed__get_article_metadata, mcp__togomcp__search_uniprot_entity, mcp__pubmed__search_articles, mcp__togomcp__search_uniprot_entity, mcp__togomcp__search_rhea_entity, mcp__pubmed__search_articles, mcp__togomcp__search_rhea_entity, mcp__togomcp__search_rhea_entity, mcp__togomcp__search_rhea_entity, mcp__pubmed__search_articles, mcp__togomcp__ncbi_esearch, mcp__pubmed__get_article_metadata, mcp__pubmed__search_articles",3,4,4,5,16,"Covers vertebrate and plant pathways and key intermediates correctly but lacks specific counts (33 proteins, 16 species), CHEBI/GO IDs, and details about which species/AANAT-ASMT split.",4,4,4,5,17,"Detailed pathway description with EC numbers and pathway alternatives; mentions correct species set but lacks the precise protein counts (33), AANAT vs ASMT splits, and ChEBI IDs from ideal."
question_005,choice,"Among the following kinase groups — AGC, CAMK, CMGC, and TK — which has the greatest number of human protein targets with experimentally determined X-ray crystal structures deposited in the PDB?

Choose one of the following options:
  - AGC
  - CAMK
  - CMGC
  - TK","TK (tyrosine kinases) has the greatest number of human protein targets with
PDB X-ray crystal structures, with 2,280 structures across 80 ChEMBL-classified
human targets. CMGC ranks second (1,539 structures, 58 targets), followed by
CAMK (734 structures, 65 targets) and AGC (422 structures, 59 targets).

TK dominates structural coverage because tyrosine kinases are the primary targets
in cancer drug discovery. The EGFR family alone (EGFR, HER2, HER3, HER4) accounts
for hundreds of entries; BCR-ABL1 (P00519) has over 200 structures due to
imatinib-resistance studies; VEGFR2/KDR (P35968), ALK (Q9UM73), c-MET (P08581),
RET (P07949), FGFR1-4, and the SRC family kinases each contribute dozens to
hundreds of structures. The pharmaceutical industry's intense focus on TK
inhibitors for oncology has driven an outsized crystallographic effort relative
to the number of targets.

CMGC ranks second because it includes intensively studied targets: CDK2 (P24941)
alone has over 400 PDB structures from fragment-based and structure-based drug
design campaigns; CDK4/6 (cyclin-dependent kinases), CDK8, CDK9, MAPK1/ERK2
(P28482), MAPK14/p38α (Q16539), GSK3B (P49841), and DYRK1A (Q13627) are all
major drug targets with large structural datasets.

CAMK ranks third despite having the most targets (65) among the four groups,
because many CAMK members (e.g., CaM kinases, DAPK, CHK1, CHK2) are less
pharmacologically tractable or have been structurally solved fewer times.

AGC ranks last (422 structures) despite its prominent members (AKT1/2/3, PKCα,
PKA, RSK1-4, S6K1) because several AGC kinases proved challenging for structural
biology due to flexibility or membrane association, and the group has fewer
members overall.

A note on cross-group overlap: 70 PDB structures (1.4%) contain proteins with
dual classification in ChEMBL (6 proteins annotated as both AGC and CAMK). These
structures are counted in both groups' totals. This overlap does not affect the
answer — TK leads CMGC by 741 structures, far exceeding the 70-structure overlap.
",True,8.1,"**TK**

The tyrosine kinase (TK) group has the greatest number of human protein targets with experimentally determined X-ray crystal structures deposited in the PDB among these four kinase groups. This is primarily because TK kinases, particularly receptor tyrosine kinases (RTKs) and non-receptor tyrosine kinases, have been extensively targeted for cancer drug development, making them a major focus of structural biology efforts over the past several decades. The pharmaceutical interest in TK inhibitors, exemplified by drugs like imatinib, gefitinib, and erlotinib, has driven substantial investment in solving crystal structures of these kinases in various states (apo, inhibitor-bound, and active/inactive conformations). Additionally, many TK family members such as EGFR, ABL, SRC, and various other RTKs have had multiple structures solved with different ligands and in different functional states. While AGC, CAMK, and CMGC kinases also have numerous structures deposited, the TK group surpasses them in total number due to this concentrated structural biology and drug discovery effort.",256,250,0.004518,True,94.84,"**TK (tyrosine kinase)**

The TK group has 114 unique human protein kinases with PDB X-ray crystal structures, more than double the other groups (AGC: 42, CAMK: 50, CMGC: 48). Tyrosine kinases include major therapeutic targets such as receptor tyrosine kinases (EGFR, VEGFR, insulin receptor family) and cytoplasmic tyrosine kinases (Src family, Abl, JAK, FAK), which have been extensively characterized by X-ray crystallography for structure-based drug discovery. The large number of TK structures reflects both their clinical importance in cancer and other diseases and their tractability for crystallographic studies.",207,4666,0.2903134,0.294831,"ToolSearch, mcp__togomcp__run_sparql, mcp__togomcp__run_sparql, mcp__togomcp__run_sparql, mcp__togomcp__run_sparql, mcp__togomcp__search_uniprot_entity, mcp__togomcp__search_uniprot_entity, mcp__togomcp__search_uniprot_entity, mcp__togomcp__search_uniprot_entity, mcp__togomcp__run_sparql, mcp__togomcp__search_pdb_entity, mcp__togomcp__search_pdb_entity, mcp__togomcp__search_pdb_entity, mcp__togomcp__search_pdb_entity",4,5,5,5,19,Correctly identifies TK with sound reasoning about NSAID/cancer drug discovery; lacks specific structure counts and target numbers.,4,5,5,5,19,Correctly identifies TK with quantitative target counts (114 vs 42/50/48); the numbers differ from the ideal but rank ordering is consistent.
