question_id,question_type,question,ideal_answer,baseline_success,baseline_time,baseline_answer,baseline_input_tokens,baseline_output_tokens,baseline_cost_usd,togomcp_success,togomcp_time,togomcp_answer,togomcp_input_tokens,togomcp_output_tokens,togomcp_cost_usd,total_cost_usd,tools_used,baseline_recall,baseline_precision,baseline_repetition,baseline_readability,baseline_total_score,baseline_evaluation_explanation,togomcp_recall,togomcp_precision,togomcp_repetition,togomcp_readability,togomcp_total_score,togomcp_evaluation_explanation
question_038,choice,"Among the five Mus musculus limb-girdle muscular dystrophy gene orthologs Capn3, Dysf, Lmna, Ano5, and Plec, which has the greatest number of protein-coding transcripts in Ensembl GRCm39?

Choose one of the following options:
  - Capn3
  - Dysf
  - Lmna
  - Ano5
  - Plec","Among the five Mus musculus limb-girdle muscular dystrophy gene orthologs compared, Plec (encoding plectin, the mouse ortholog of the human LGMD2Q gene PLEC) has by far the greatest number of protein-coding transcripts in Ensembl GRCm39 with 21 isoforms, followed by Dysf (dysferlin, LGMD2B ortholog) with 12, Capn3 (calpain 3, LGMD2A ortholog) with 10, Lmna (lamin A, LGMD1B ortholog) with 4, and Ano5 (anoctamin 5, LGMD2L ortholog) with 3. Plec's exceptional transcript diversity reflects its unique genomic architecture: the mouse Plec gene encodes at least 11 alternative first exons (1a–1j and a common exon 2) that each splice into a shared downstream coding region, producing tissue-specific isoforms directed to distinct subcellular compartments — for example, isoform 1a targets hemidesmosomes in epithelia while isoform 1f localises to costameres and Z-discs in striated muscle. Dysf's 12 isoforms reflect alternative splicing of its tandem C2 domain array, relevant to its role in membrane repair at the sarcolemma. Capn3's 10 isoforms include the muscle-specific p94 form and lens isoform Lp82 arising from alternative promoter usage. By contrast, Lmna (4 isoforms, primarily lamin A and lamin C from alternative splicing at exon 10) and Ano5 (3 isoforms) are architecturally simpler. The striking isoform count difference between Plec and Ano5 (21 vs. 3) therefore does not reflect clinical severity but rather the mechanistic complexity of their membrane-cytoskeleton scaffolding roles versus channel/lipid scramblase functions.
",True,7.7,"The correct answer is **Plec**.

Plec (plectin) has the greatest number of protein-coding transcripts among these five mouse limb-girdle muscular dystrophy gene orthologs in Ensembl GRCm39. Plectin is a large cytolinker protein that connects intermediate filaments to various cellular structures, and its gene exhibits extensive alternative splicing, generating numerous tissue-specific isoforms with different N-terminal domains. This biological complexity is reflected in its transcript diversity in Ensembl, where it typically has over 20 protein-coding transcript variants. In contrast, the other genes have fewer protein-coding transcripts: Capn3 (calpain-3) has relatively few transcripts as a more straightforward protease gene; Dysf (dysferlin) and Ano5 (anoctamin-5) have moderate transcript numbers; and while Lmna (lamin A/C) does produce multiple isoforms through alternative splicing, it has fewer protein-coding transcripts than Plec. The extensive alternative splicing of Plec reflects its diverse functional roles across different tissues and cellular compartments.",284,259,0.004737,True,38.81,"**Plec** has the greatest number of protein-coding transcripts among the five genes. In Ensembl GRCm39, Plec encodes 21 protein-coding transcripts, substantially more than the other limb-girdle muscular dystrophy orthologs: Dysf has 12 transcripts, Capn3 has 10, Lmna has 4, and Ano5 has only 3. This high transcript diversity in Plec reflects extensive alternative splicing, which generates multiple protein isoforms from the single Plec gene locus.",123,1573,0.13820415,0.142941,"ToolSearch, ToolSearch, mcp__togomcp__get_MIE_file, mcp__togomcp__run_sparql",4,5,5,5,19,Correctly chooses Plec and explains its tissue-specific isoforms; lacks specific counts but reasoning is solid.,5,5,5,5,20,"Exactly matches ideal: Plec with 21 transcripts and other counts (12, 10, 4, 3) precisely correct."
question_039,list,"Which distinct human genes, co-annotated with Brugada syndrome in at least 500 PubMed articles in PubTator Central, also have a drug target entry in ChEMBL?","All five human genes co-annotated with Brugada syndrome in at least 500 PubMed articles in PubTator Central also have drug target entries in ChEMBL. Ranked by co-annotation frequency, these genes and their ChEMBL targets are: SCN5A (2,768 articles; CHEMBL1980, Nav1.5), KCNH2 (935 articles; CHEMBL240, hERG), KCNQ1 (767 articles; CHEMBL1866, Kv7.1), CACNA1C (660 articles; CHEMBL1940, Cav1.2), and RYR2 (632 articles; CHEMBL4403, RyR2). SCN5A encodes the cardiac sodium channel Nav1.5 and is the primary causal gene for Brugada syndrome, responsible for 15–30% of cases through loss-of-function variants; its ChEMBL entry reflects its central role as a drug target for antiarrhythmic compounds and as a cardiac safety liability. The potassium channels KCNH2 (hERG) and KCNQ1 (Kv7.1) are prominent ChEMBL targets because inhibition of hERG is a major mechanism of drug-induced QT prolongation and ventricular arrhythmia. CACNA1C encodes the L-type calcium channel Cav1.2, a target for dihydropyridine and non-dihydropyridine calcium channel blockers. RYR2 (ryanodine receptor 2) is targeted by flecainide and other agents used in catecholaminergic polymorphic ventricular tachycardia, a related channelopathy with substantial overlap in the research literature. The complete overlap between the high-frequency co-annotation set and ChEMBL pharmacological targets reflects the ion-channel-centric pathophysiology of Brugada syndrome and the translational significance of these genes in cardiac drug development and safety pharmacology.
",True,6.24,"I cannot provide a definitive answer to this question as it requires real-time access to specific databases that I don't have: PubTator Central for co-annotation frequencies of genes with Brugada syndrome across PubMed articles, and ChEMBL for current drug target entries. While I know that SCN5A (encoding the cardiac sodium channel Nav1.5) is the most prominently associated gene with Brugada syndrome and is extensively studied in the literature, I cannot verify whether it or any other Brugada-associated genes meet the specific threshold of 500+ PubMed co-annotations in PubTator Central, nor can I confirm their current ChEMBL drug target status without querying these databases directly. Other genes associated with Brugada syndrome include SCN10A, CACNA1C, CACNB2, GPD1L, and several others, but determining which of these meet both your specified criteria would require direct database queries that I cannot perform.",349,220,0.004347,True,173.01,"Five distinct human genes meet both criteria: SCN5A, KCNH2, KCNQ1, CACNA1C, and RYR2. SCN5A (sodium voltage-gated channel alpha subunit 5) is co-annotated with Brugada syndrome in 2,768 PubMed articles and corresponds to ChEMBL target CHEMBL1980. KCNH2 (potassium voltage-gated channel subfamily H member 2) appears in 935 articles and is represented as ChEMBL target CHEMBL240. KCNQ1 (potassium voltage-gated channel subfamily Q member 1) is found in 767 articles and maps to ChEMBL target CHEMBL1866. CACNA1C (calcium voltage-gated channel subunit alpha1 C) is co-annotated in 660 articles and corresponds to ChEMBL target CHEMBL1940. RYR2 (ryanodine receptor 2) appears in 632 articles and is represented as ChEMBL target CHEMBL4403. All five genes encode cardiac ion channels or calcium regulators directly involved in cardiac electrophysiology, reflecting the pathophysiology of Brugada syndrome as a cardiac arrhythmia disorder, and all are established drug targets in the ChEMBL database.",337,4092,0.30539645,0.309743,"ToolSearch, ToolSearch, mcp__claude_ai_TogoMCP-Test__run_sparql, mcp__claude_ai_TogoMCP-Test__run_sparql, ToolSearch, mcp__claude_ai_TogoMCP-Test__get_MIE_file, ToolSearch, mcp__claude_ai_TogoMCP-Test__search_mesh_descriptor, mcp__claude_ai_TogoMCP-Test__run_sparql, ToolSearch, mcp__claude_ai_TogoMCP-Test__ncbi_esummary, mcp__togomcp__search_chembl_target, mcp__togomcp__search_chembl_target, mcp__togomcp__search_chembl_target, mcp__togomcp__search_chembl_target, mcp__togomcp__search_chembl_target",1,3,4,4,12,"Refuses to provide the specific list; mentions a few genes but with different ones than ideal (SCN10A, CACNB2, GPD1L) and no counts or ChEMBL IDs.",5,5,5,5,20,"Exact match to ideal: lists 5 correct genes with precise PMID counts (2768, 935, 767, 660, 632) and ChEMBL IDs."
question_040,list,"Among the 13 established human neuronal ceroid lipofuscinosis (NCL) disease genes—PPT1, TPP1, CLN3, DNAJC5, CLN5, CLN6, MFSD8, CLN8, CTSD, GRN, ATP13A2, CTSF, and KCTD7—which ones encode proteins that are annotated with the lysosome cellular component (GO:0005764) in UniProt AND have more than 100 pathogenic or likely pathogenic germline variants recorded in ClinVar?","Six of the 13 established human NCL disease genes encode proteins with UniProt GO:0005764
(lysosome) annotation AND have more than 100 pathogenic or likely pathogenic germline
variants in ClinVar. These are:

1. CLN3 (Q13286) — 307 pathogenic/LP variants; CLN3/battenin, the most frequently mutated
   NCL gene, causes juvenile Batten disease (CLN3 disease), the most common NCL form.
2. TPP1 (O14773) — 231 pathogenic/LP variants; tripeptidyl-peptidase 1 (CLN2), a lysosomal
   serine protease whose deficiency causes late-infantile NCL.
3. CLN5 (O75503) — 222 pathogenic/LP variants; a lysosomal soluble protein causing variant
   late-infantile NCL (CLN5 disease).
4. PPT1 (P50897) — 188 pathogenic/LP variants; palmitoyl-protein thioesterase 1 (CLN1),
   a lysosomal thioesterase whose deficiency causes infantile NCL.
5. GRN (P28799) — 147 pathogenic/LP variants; progranulin (CLN11), a lysosomal growth
   factor whose deficiency causes adult-onset NCL.
6. ATP13A2 (Q9NQ11) — 107 pathogenic/LP variants; a lysosomal membrane P-type ATPase
   (CLN12) also associated with Kufor-Rakeb syndrome.

Two additional NCL proteins have lysosomal annotation (GO:0005764) but fewer than 100
pathogenic variants: CTSD/CLN10 (87 variants) and CTSF/CLN13 (46 variants), reflecting
their more recently discovered roles as NCL disease genes and rarer clinical presentations.
The five remaining NCL gene proteins—DNAJC5, CLN6, MFSD8, CLN8, and KCTD7—lack GO:0005764
annotation in UniProt because they localize primarily to the ER, synaptic terminals,
or cytoplasm rather than lysosomes.
",True,7.32,"Among the 13 neuronal ceroid lipofuscinosis (NCL) disease genes, TPP1, CLN5, MFSD8, and CTSD encode proteins annotated with the lysosome cellular component (GO:0005764) in UniProt and have more than 100 pathogenic or likely pathogenic germline variants in ClinVar. TPP1 encodes tripeptidyl-peptidase 1, a lysosomal serine protease with over 200 documented pathogenic variants causing CLN2 disease. CLN5 encodes a soluble lysosomal glycoprotein involved in lysosomal function, with more than 100 pathogenic variants associated with CLN5 disease. MFSD8 encodes a lysosomal transmembrane protein, major facilitator superfamily domain containing 8, which has accumulated over 100 pathogenic variants linked to CLN7 disease. CTSD encodes cathepsin D, a lysosomal aspartic protease with more than 100 pathogenic variants causing CLN10 disease. The remaining NCL genes either lack lysosomal annotation in UniProt (such as DNAJC5, which is primarily associated with presynaptic terminals, or KCTD7, which has limited lysosomal association) or have fewer than 100 pathogenic variants documented in ClinVar despite having lysosomal localization (such as CLN3, CLN6, CLN8, GRN, ATP13A2, and CTSF).",435,356,0.006645,True,143.43,"Among the 13 established NCL disease genes, seven encode proteins annotated with the lysosome cellular component (GO:0005764) in UniProt and have more than 100 pathogenic or likely pathogenic germline variants in ClinVar: PPT1 (176 variants), TPP1 (297 variants), CLN3 (306 variants), CLN5 (229 variants), CTSD (125 variants), GRN (166 variants), and ATP13A2 (170 variants). Eight of the 13 genes encode lysosome-annotated proteins (PPT1, TPP1, CLN3, CLN5, CTSD, GRN, ATP13A2, and CTSF), while the remaining five (DNAJC5, CLN6, MFSD8, CLN8, and KCTD7) lack this annotation in UniProt. Of the eight lysosome-annotated genes, CTSF falls below the 100-variant threshold with only 91 pathogenic or likely pathogenic germline variants recorded in ClinVar, excluding it from the final set of seven genes meeting both criteria.",391,6200,0.26243725,0.269082,"ToolSearch, mcp__togomcp__search_uniprot_entity, mcp__togomcp__search_uniprot_entity, mcp__togomcp__search_uniprot_entity, mcp__togomcp__search_uniprot_entity, mcp__togomcp__search_uniprot_entity, mcp__togomcp__search_uniprot_entity, mcp__togomcp__search_uniprot_entity, mcp__togomcp__search_uniprot_entity, mcp__togomcp__search_uniprot_entity, mcp__togomcp__search_uniprot_entity, mcp__togomcp__search_uniprot_entity, mcp__togomcp__search_uniprot_entity, mcp__togomcp__search_uniprot_entity, ToolSearch, mcp__togomcp__run_sparql, mcp__togomcp__run_sparql, mcp__togomcp__run_sparql, mcp__togomcp__run_sparql, mcp__togomcp__run_sparql, mcp__togomcp__ncbi_esearch, mcp__togomcp__ncbi_esearch, mcp__togomcp__ncbi_esearch, mcp__togomcp__ncbi_esearch, mcp__togomcp__ncbi_esearch, mcp__togomcp__ncbi_esearch, mcp__togomcp__ncbi_esearch, mcp__togomcp__ncbi_esearch",2,3,4,4,13,"Lists only 4 genes with only 2 (TPP1, CLN5) matching ideal; incorrectly includes MFSD8 (no GO:0005764) and CTSD (only 87 variants); misses PPT1, CLN3, GRN, ATP13A2.",4,4,4,5,17,"Lists 7 genes with 6 (PPT1, TPP1, CLN3, CLN5, GRN, ATP13A2) correctly matching ideal; incorrectly includes CTSD (125 vs ideal's 87 variants), suggesting threshold disagreement."
question_041,choice,"Among Cyclooxygenase-1, Cyclooxygenase-2, Prostaglandin E synthase, and Hematopoietic prostaglandin D synthase — four enzymes that catalyse sequential steps in the prostaglandin biosynthesis pathway — which has the greatest number of documented bioactivity records?

Choose one of the following options:
  - Cyclooxygenase-1
  - Cyclooxygenase-2
  - Prostaglandin E synthase
  - Hematopoietic prostaglandin D synthase","Cyclooxygenase-2 (COX-2, PTGS2, CHEMBL230) has the greatest number of bioactivity records
with 14,150, followed by Cyclooxygenase-1 (COX-1, PTGS1, CHEMBL221) with 9,299, Prostaglandin
E synthase (mPGES-1, PTGES, CHEMBL5658) with 3,085, and Hematopoietic prostaglandin D
synthase (HPGDS, CHEMBL5879) with only 658. The four enzymes catalyse sequential steps
confirmed in Rhea: COX-1 and COX-2 share EC 1.14.99.1 and convert arachidonate to
prostaglandin H2 (RHEA:23728); HPGDS (EC 5.3.99.2) and PTGES (EC 5.3.99.3) branch
PGH2 toward PGD2 (RHEA:10600) and PGE2 (RHEA:12893) respectively. The dominance of
COX-2 in ChEMBL reflects its status as the primary NSAID selectivity target: the
observation that selective COX-2 inhibitors (celecoxib, rofecoxib, etoricoxib) spare
gastric COX-1 drove two decades of drug discovery that generated the largest body of
structure-activity data for any single prostaglandin biosynthesis enzyme. COX-1 ranks
second because most non-selective NSAIDs (ibuprofen, naproxen, indomethacin) were
characterised against both isoforms. mPGES-1 has attracted strong research interest as
a downstream target with fewer GI liabilities, but the field is younger, while HPGDS
— primarily implicated in prostaglandin D2-driven allergic inflammation — has a much
narrower inhibitor program reflected in its smaller ChEMBL footprint.
",True,7.94,"**Cyclooxygenase-2** has the greatest number of documented bioactivity records among these four enzymes.

COX-2 has been extensively studied as a major drug target, particularly for non-steroidal anti-inflammatory drugs (NSAIDs) and selective COX-2 inhibitors (coxibs) like celecoxib and rofecoxib. The development of selective COX-2 inhibitors as anti-inflammatory and analgesic agents with reduced gastrointestinal side effects compared to non-selective NSAIDs drove massive screening efforts and bioactivity profiling throughout the 1990s and 2000s. While COX-1 is also a well-studied NSAID target, COX-2's inducible nature, role in inflammation and cancer, and status as the preferred target for safer anti-inflammatory therapy has made it the focus of more extensive drug discovery campaigns. The downstream enzymes—prostaglandin E synthase and hematopoietic prostaglandin D synthase—are more recently recognized drug targets with substantially fewer compounds tested against them. Consequently, COX-2 accumulated the most bioactivity data across multiple chemical libraries and screening programs.",311,270,0.004983,True,169.36,"**Cyclooxygenase-2**

Cyclooxygenase-2 has the greatest number of documented bioactivity records with 15,828 activities in ChEMBL, substantially exceeding Cyclooxygenase-1 (9,826 records), Prostaglandin E synthase (5,206 records), and Hematopoietic prostaglandin D synthase (685 records). COX-2's prominence in the database reflects its importance as a therapeutic target for non-steroidal anti-inflammatory drugs (NSAIDs), particularly selective COX-2 inhibitors like celecoxib, which has driven extensive screening and characterization efforts in pharmaceutical research. While COX-1 is also a well-studied NSAID target, the focus on developing selective COX-2 inhibitors to reduce gastrointestinal side effects has generated particularly intensive bioactivity profiling for this isoform.",421,6009,0.2339998999999999,0.238983,"ToolSearch, mcp__togomcp__search_chembl_target, mcp__togomcp__search_chembl_target, mcp__togomcp__search_chembl_target, mcp__togomcp__search_chembl_target, mcp__togomcp__search_chembl_target, mcp__togomcp__search_chembl_target, mcp__togomcp__search_chembl_target, mcp__togomcp__search_chembl_target, ToolSearch, mcp__togomcp__search_chembl_id_lookup, mcp__togomcp__search_chembl_id_lookup, mcp__togomcp__search_chembl_id_lookup, mcp__togomcp__search_chembl_target, mcp__togomcp__search_chembl_target, mcp__togomcp__search_chembl_target, mcp__togomcp__search_chembl_id_lookup, mcp__togomcp__search_chembl_target, mcp__togomcp__search_chembl_target, mcp__togomcp__search_chembl_id_lookup, mcp__togomcp__search_chembl_target, mcp__togomcp__search_chembl_id_lookup, ToolSearch, mcp__togomcp__run_sparql, mcp__togomcp__run_sparql, mcp__togomcp__run_sparql",4,5,5,5,19,Correctly chooses COX-2 with sound rationale about NSAID drug discovery; lacks specific bioactivity counts.,5,5,5,5,20,Correctly chooses COX-2 with quantitative ranking; counts (15828 vs ideal 14150) are close and ranking matches.
question_042,yes_no,"Is Leigh syndrome classified as a designated intractable disease with an official notification number in the Japanese national rare disease classification system, and does it have a cross-referenced OMIM entry documented in medical genetics databases?","Leigh syndrome is both classified as a designated intractable disease in the Japanese national rare disease classification system (NANDO) and has OMIM cross-references documented in MedGen. The structured NANDO query via MONDO:0009723 (skos:closeMatch) reveals two designated entries: NANDO:2200527 (""Leigh syndrome"", notification number 92) and NANDO:1200175 (""Leigh's encephalomyelopathy"", notification number 21), both officially recognized by Japan's Ministry of Health, Labour and Welfare as notifiable intractable diseases eligible for government support programs. In MedGen, the canonical Leigh syndrome concept (CUI C2931891) cross-references OMIM:256000 via mgconso blank nodes, which catalogues the genetic heterogeneity of this mitochondrial encephalomyopathy across multiple causal genes affecting OXPHOS complexes. Leigh syndrome is a rare, progressive mitochondrial encephalomyopathy characterized by subacute necrotizing lesions in the brainstem and basal ganglia, caused by defects in mitochondrial oxidative phosphorylation. The structured query approach via MONDO:0009723 uncovered the two-entry NANDO representation that text-based searches might miss, illustrating how ontology-guided lookup yields more complete results for rare disease classification queries.
",True,6.2,"Leigh syndrome is classified as a designated intractable disease in Japan's national rare disease system under notification number 21, making it eligible for medical subsidies and specialized care programs. The condition has multiple cross-referenced entries in the Online Mendelian Inheritance in Man (OMIM) database due to its genetic heterogeneity, with the primary entry being OMIM #256000 for the classic mitochondrial form. Additional OMIM entries document various genetic subtypes caused by mutations in different nuclear and mitochondrial genes, including entries for X-linked forms (OMIM #308930), nuclear-encoded subunit deficiencies, and specific gene mutations associated with the syndrome. This dual classification reflects both the clinical recognition of Leigh syndrome as a serious progressive neurometabolic disorder requiring governmental support in Japan and its well-established genetic basis documented through decades of molecular genetics research compiled in medical databases.",347,194,0.003951,True,65.86,"Yes, Leigh syndrome is classified as a designated intractable disease in the Japanese national rare disease classification system with official notification number 92 (NANDO:2200527). The disease has a documented cross-reference to the OMIM entry 256000, which is accessible through the MONDO Disease Ontology (MONDO:0009723) that serves as an international harmonization bridge for the Japanese NANDO database.",207,2667,0.2152277,0.219179,"ToolSearch, mcp__togomcp__find_databases, ToolSearch, mcp__togomcp__get_MIE_file, mcp__togomcp__run_sparql, mcp__togomcp__run_sparql, mcp__togomcp__get_MIE_file, mcp__togomcp__run_sparql",3,4,4,5,16,Correctly answers yes with notification number 21 (which matches one of the two NANDO entries) and OMIM 256000; misses the second NANDO entry.,4,5,5,5,19,Correctly answers yes with notification number 92 (matching primary NANDO:2200527) and OMIM 256000; concise but misses the second NANDO entry.
question_043,factoid,"How many approved biochemical reactions are annotated with 1,4-dihydroxy-2-naphthoate as a participant?","There are 10 approved biochemical reactions annotated with 1,4-dihydroxy-2-naphthoate (DHNA; CHEBI:11173; molecular formula C11H7O4, mass 203.17 Da) as a participant. DHNA is the key intermediate in the classical bacterial menaquinone biosynthesis (Men) pathway, positioned at the junction between the early shikimate-derived steps and the isoprenoid chain attachment stage. Nine of the 10 reactions are catalyzed by MenA-type 1,4-dihydroxy-2-naphthoate octaprenyltransferases: one generic reaction covers all-trans-polyprenyl chain lengths (RHEA:26478), and eight chain-length-specific reactions cover hexaprenyl (MK-6), heptaprenyl (MK-7), octaprenyl (MK-8), nonaprenyl (MK-9), decaprenyl (MK-10), undecaprenyl (MK-11), dodecaprenyl (MK-12), and tridecaprenyl (MK-13) diphosphates as cosubstrates, each producing the corresponding demethylmenaquinol and releasing CO2 and diphosphate. The tenth reaction (RHEA:26309) is the upstream MenH thioesterase step that produces DHNA by hydrolysis of 1,4-dihydroxy-2-naphthoyl-CoA. This enzymatic diversity reflects the organism-specific variation in menaquinone side-chain length across bacteria.
",True,6.77,"I cannot provide a specific number of approved biochemical reactions annotated with 1,4-dihydroxy-2-naphthoate as a participant, as this requires querying specialized biochemical databases such as KEGG, MetaCyc, or Rhea that track curated metabolic reactions. 1,4-dihydroxy-2-naphthoate (also known as 1,4-dihydroxy-2-naphthoic acid or DHNA) is an intermediate in the menaquinone (vitamin K2) biosynthesis pathway, where it typically participates in reactions catalyzed by enzymes such as 1,4-dihydroxy-2-naphthoate octaprenyltransferase (MenA) and is formed by enzymes like o-succinylbenzoate synthase (MenC). The exact count of annotated reactions would depend on the specific database, its curation criteria for ""approved"" reactions, and whether it includes variations across different organisms and pathways. To obtain this information, one would need to perform a direct database query using the compound's identifier or systematic name.",333,255,0.004824,True,169.21,"Ten approved biochemical reactions are annotated with 1,4-dihydroxy-2-naphthoate as a participant in the Rhea database. These include one hydrolysis reaction that produces 1,4-dihydroxy-2-naphthoate from its CoA ester (RHEA:26309), and nine prenylation reactions where 1,4-dihydroxy-2-naphthoate condenses with various all-trans-polyprenyl diphosphates of different chain lengths (ranging from hexaprenyl to tridecaprenyl) to form 2-demethylmenaquinol derivatives with release of carbon dioxide and diphosphate. These prenylation reactions represent key steps in menaquinone (vitamin K2) biosynthesis, where the naphthoate moiety is attached to isoprenoid side chains of varying lengths to generate the different forms of vitamin K2 found in various organisms.",180,5579,0.2083124499999999,0.213136,"ToolSearch, mcp__togomcp__search_rhea_entity, mcp__togomcp__run_sparql, mcp__togomcp__run_sparql, mcp__togomcp__run_sparql, mcp__togomcp__run_sparql, mcp__togomcp__run_sparql",1,3,4,4,12,Refuses to provide a count; describes the pathway generically without the answer.,5,5,5,5,20,Exact match (10 reactions) with breakdown (1 hydrolysis + 9 prenylation) matching ideal precisely.
