question_id,question_type,question,ideal_answer,baseline_success,baseline_time,baseline_answer,baseline_input_tokens,baseline_output_tokens,baseline_cost_usd,togomcp_success,togomcp_time,togomcp_answer,togomcp_input_tokens,togomcp_output_tokens,togomcp_cost_usd,total_cost_usd,tools_used,baseline_recall,baseline_precision,baseline_repetition,baseline_readability,baseline_total_score,baseline_evaluation_explanation,togomcp_recall,togomcp_precision,togomcp_repetition,togomcp_readability,togomcp_total_score,togomcp_evaluation_explanation
question_025,choice,"Among the voltage-gated potassium channel genes KCNQ2, KCNQ3, KCNB1, and KCNT1 — each causally linked to distinct epilepsy syndromes classified under the epilepsy disease class (MONDO:0005027) — which gene has the greatest number of pathogenic or likely pathogenic germline variants currently documented in ClinVar?

Choose one of the following options:
  - KCNQ2
  - KCNQ3
  - KCNB1
  - KCNT1","Among the four voltage-gated potassium channel genes KCNQ2, KCNQ3, KCNB1, and KCNT1 — all associated with MONDO-classified epilepsy syndromes — KCNQ2 (gene ID 3785, chromosome 20q13.33) has by far the greatest number of pathogenic or likely pathogenic germline variants in ClinVar, with 759 such variants, compared to 118 for KCNT1, and 102 each for KCNB1 and KCNQ3 (ClinVar January 2025 release; arithmetic verification: sum 1,081 > total distinct 1,077, indicating 4 variants attributed to multiple genes). This substantial variant burden reflects KCNQ2's role as the causal gene for both the severe DEE7 (developmental and epileptic encephalopathy 7, MONDO:0013387) and the milder benign familial neonatal convulsions type 1, making it a major target of clinical sequencing in pediatric epilepsy. KCNQ2 and KCNQ3 encode the Kv7.2 and Kv7.3 subunits that co-assemble to form the neuronal M-channel responsible for regulating neuronal excitability; KCNQ2 variants are more frequently pathogenic and more clinically diverse in severity than KCNQ3 variants, which mainly cause the milder BFNC2 (MONDO:0007366). KCNT1 encodes the sodium-activated KNa1.1 (SLACK) channel and causes the severe epilepsy of infancy with migrating focal seizures (EIMFS, MONDO:0100025), while KCNB1 encodes the Kv2.1 delayed-rectifier channel associated with DEE34 (MONDO:0014718); both have a smaller but clinically significant variant spectrum compared to KCNQ2.
",True,7.75,"**KCNQ2**

KCNQ2 has the greatest number of pathogenic or likely pathogenic germline variants documented in ClinVar among these four voltage-gated potassium channel genes. KCNQ2 is associated with benign familial neonatal seizures (BFNS) and KCNQ2-related epileptic encephalopathy, conditions that have been extensively characterized since the gene's discovery in the 1990s. The relatively high prevalence of KCNQ2-related epilepsies, combined with widespread clinical genetic testing for neonatal and early infantile epilepsy syndromes, has led to the identification and submission of numerous pathogenic variants to ClinVar. While KCNQ3, KCNB1, and KCNT1 are also important epilepsy genes—associated with BFNS (KCNQ3), developmental and epileptic encephalopathy (KCNB1), and various epilepsy syndromes including autosomal dominant nocturnal frontal lobe epilepsy and epilepsy of infancy with migrating focal seizures (KCNT1)—these genes have fewer documented pathogenic variants in ClinVar, reflecting either lower disease prevalence, more recent disease-gene associations, or reduced ascertainment in clinical testing panels.",312,309,0.005571,True,32.67,"**KCNQ2**

KCNQ2 has 1,029 pathogenic or likely pathogenic germline variants documented in ClinVar, substantially more than the other three genes. KCNT1 follows with 286 variants, KCNQ3 has 257 variants, and KCNB1 has 217 variants. The markedly higher variant count for KCNQ2 reflects its role as a major causative gene for early infantile epileptic encephalopathy and benign familial neonatal seizures, conditions that have been extensively studied and genetically characterized over the past two decades.",117,1448,0.0887983,0.094369,"ToolSearch, mcp__togomcp__ncbi_esearch, mcp__togomcp__ncbi_esearch, mcp__togomcp__ncbi_esearch, mcp__togomcp__ncbi_esearch",4,5,5,5,19,Correctly chooses KCNQ2 with reasonable rationale about disease prevalence and clinical testing; lacks specific variant counts.,4,5,5,5,19,Correctly chooses KCNQ2 with quantitative ranking; counts differ from ideal (1029 vs 759) but ranking is consistent and other counts roughly match relative magnitudes.
question_026,yes_no,"Is 6,7-dimethyl-8-(1-D-ribityl)lumazine classified in PubChem as a pteridine (CHEBI:17601) and documented as a substrate in an approved Rhea reaction catalyzed by riboflavin synthase (EC 2.5.1.9)?","Yes. 6,7-dimethyl-8-(1-D-ribityl)lumazine is classified in PubChem as the pteridine CHEBI:17601 (CID:168989), and its pH-7.3 microspecies (CHEBI:58201, CID:46931117) is documented as the direct substrate of the approved Rhea reaction RHEA:20772 catalyzed by riboflavin synthase (EC 2.5.1.9). In this reaction, two molecules of the lumazine intermediate undergo a dismutation: one is oxidized to release the four-carbon fragment that becomes the dimethylbenzene ring of riboflavin, while the other is reduced back to 5-amino-6-(D-ribitylamino)uracil, an earlier precursor in the riboflavin pathway. The reaction is chemically balanced, Approved in Rhea, and annotated with GO:0004746 (riboflavin synthase activity). The pteridine scaffold of the lumazine substrate is thus the direct biosynthetic precursor to the isoalloxazine ring system of riboflavin (vitamin B2).
",True,5.91,"6,7-dimethyl-8-(1-D-ribityl)lumazine is classified in PubChem as a pteridine, consistent with CHEBI:17601, as it contains the characteristic pteridine ring system (a fused pyrimidine-pyrazine bicyclic structure). This compound serves as a substrate in Rhea-approved reactions catalyzed by riboflavin synthase (EC 2.5.1.9), which catalyzes the dismutation of two molecules of 6,7-dimethyl-8-(1-D-ribityl)lumazine to produce one molecule of riboflavin (vitamin B2) and one molecule of 5-amino-6-(D-ribitylamino)uracil. This enzymatic reaction represents the final step in riboflavin biosynthesis in bacteria, fungi, and plants, making 6,7-dimethyl-8-(1-D-ribityl)lumazine the immediate precursor to riboflavin and a well-documented substrate for this enzyme in biochemical databases including Rhea.",378,251,0.004899,True,70.23,"Yes. 6,7-dimethyl-8-(1-D-ribityl)lumazine (PubChem compound CID 168989) is explicitly classified in PubChem as a pteridine (CHEBI:17601) and serves as a substrate in the approved Rhea reaction RHEA:20772, which is catalyzed by riboflavin synthase (EC 2.5.1.9). In this reaction, two molecules of 6,7-dimethyl-8-(1-D-ribityl)lumazine undergo dismutation to produce riboflavin and 5-amino-6-(D-ribitylamino)uracil.",214,2980,0.1553247999999999,0.160224,"ToolSearch, mcp__togomcp__get_pubchem_compound_id, mcp__togomcp__get_compound_attributes_from_pubchem, mcp__togomcp__search_rhea_entity, mcp__togomcp__search_rhea_entity, ToolSearch, mcp__togomcp__run_sparql, mcp__togomcp__run_sparql, mcp__togomcp__run_sparql",3,4,4,5,16,Correctly answers yes and describes the dismutation mechanism; lacks the specific PubChem CID and RHEA reaction identifier from ideal.,5,5,5,5,20,"Provides exact CID 168989, CHEBI:17601, and RHEA:20772; concise and matches ideal precisely."
question_027,factoid,How many distinct approved biochemical reactions in the Rhea database are collectively annotated for the reviewed human enzymatic catalysts of the nicotinate metabolism pathway?,"The 22 reviewed human enzymatic catalysts of the Reactome nicotinate metabolism pathway are collectively annotated with 58 distinct approved reactions in the Rhea database. This repertoire encompasses the full biochemical breadth of these enzymes beyond their nicotinate-specific roles: the pathway itself covers the Preiss-Handler route (nicotinate → NaMN → deamido-NAD+ → NAD+ via NAPRT, NMNAT1-3, and NADSYN1), the NAD+ salvage route (nicotinamide → NMN → NAD+ via NAMPT and NMNATs), and NAD+ consumption and recycling steps (CD38/BST1 glycohydrolases, NNMT methyltransferase, NT5E nucleotidase). The per-enzyme Rhea contribution varies widely: the sodium-coupled monocarboxylate transporter SLC5A8 (Q8N695) links to 14 approved reactions reflecting its broad substrate range for short-chain carboxylates including nicotinate, while NT5E/CD73 (P21589) contributes 10 reactions covering all its nucleoside monophosphate substrates. CD38 (P28907) accounts for 6 reactions including NAD+ glycohydrolase, ADP-ribosyl cyclase, and cyclic ADP-ribose hydrolase activities. The 58-reaction total from 22 enzymes (68 protein-reaction pairs) reflects 10 shared reactions catalysed by multiple enzyme paralogues — for instance, the core NAD+ glycohydrolase reaction (Rhea:16301) is shared by both CD38 and BST1/CD157. In contrast, NAMPT, NADK, NAPRT, QPRT, and NNMT each contribute a single Rhea reaction reflecting their narrow substrate specificity, while NMNAT1 (Q9HAN9) contributes 2 approved reactions — covering both NMN (Rhea:21360) and NaMN (Rhea:22860) as substrates — consistent with its dual role in both the salvage and Preiss-Handler de novo routes to NAD+.
",True,7.74,"I cannot provide a specific numerical answer to this question as it requires real-time access to the Rhea database and cross-referencing with current annotations for reviewed human enzymes in the nicotinate metabolism pathway. The Rhea database is a comprehensive resource of biochemical reactions that is regularly updated, and determining the exact count would require querying the database for reactions associated with reviewed (Swiss-Prot) human enzymes specifically involved in nicotinate metabolism, then counting the distinct approved reactions. The nicotinate metabolism pathway in humans involves enzymes that catalyze reactions related to the synthesis and degradation of nicotinamide adenine dinucleotide (NAD+) and related compounds, including enzymes such as nicotinamide phosphoribosyltransferase, nicotinate phosphoribosyltransferase, and various NAD synthetases and deamidases. Without direct database access, I cannot determine whether this represents dozens or hundreds of distinct Rhea-annotated reactions, as the answer depends on the current state of curation in both Rhea and UniProtKB/Swiss-Prot databases, including how broadly or narrowly the pathway boundaries are defined and which reaction variants are considered distinct.",336,267,0.005013,True,458.02,"Based on systematic querying of the UniProt and Rhea databases, the reviewed human enzymatic catalysts of the nicotinate metabolism pathway collectively catalyze 18 distinct approved biochemical reactions in Rhea. These enzymes participate in three major routes: the kynurenine pathway converting tryptophan to quinolinate (8 reactions catalyzed by IDO1, TDO2, AFMID, KMO, KYNU, HAAO, and ACMSD), the Preiss-Handler pathway synthesizing NAD from quinolinate or nicotinate (4 reactions catalyzed by QPRT, NAPRT, NMNAT1/2/3, and NADSYN1), and the salvage pathways recycling nicotinamide and nucleoside precursors (3 reactions catalyzed by NAMPT, NRK1/2, and NMNAT1/2/3), plus additional reactions for nicotinic acid riboside salvage (NRK1/2), NAD phosphorylation to NADP (NADK and NADK2), and nicotinamide catabolism (NNMT). All 18 Rhea reactions carry approved status, representing the complete enzymatic repertoire by which humans synthesize, salvage, and metabolize nicotinate-derived cofactors.",949,23885,1.04449805,1.049511,"ToolSearch, mcp__togomcp__search_uniprot_entity, mcp__togomcp__search_uniprot_entity, mcp__togomcp__run_sparql, mcp__togomcp__run_sparql, mcp__togomcp__run_sparql, mcp__togomcp__run_sparql, mcp__togomcp__run_sparql, mcp__togomcp__run_sparql, mcp__togomcp__run_sparql, mcp__togomcp__run_sparql, mcp__togomcp__run_sparql, mcp__togomcp__run_sparql, mcp__togomcp__run_sparql, mcp__togomcp__run_sparql, mcp__togomcp__run_sparql, mcp__togomcp__run_sparql, mcp__togomcp__run_sparql, ToolSearch, mcp__togomcp__run_sparql, mcp__togomcp__run_sparql, mcp__togomcp__run_sparql, mcp__togomcp__run_sparql, mcp__togomcp__run_sparql, mcp__togomcp__run_sparql, mcp__togomcp__run_sparql, mcp__togomcp__run_sparql, mcp__togomcp__run_sparql, mcp__togomcp__run_sparql, mcp__togomcp__run_sparql, mcp__togomcp__run_sparql, mcp__togomcp__run_sparql, mcp__togomcp__run_sparql, mcp__togomcp__search_uniprot_entity, mcp__togomcp__run_sparql, mcp__togomcp__run_sparql, mcp__togomcp__search_uniprot_entity, mcp__togomcp__run_sparql, mcp__togomcp__search_uniprot_entity, mcp__togomcp__run_sparql, mcp__togomcp__run_sparql, mcp__togomcp__run_sparql, mcp__togomcp__run_sparql",1,3,4,4,12,Refuses to provide a number; only describes the pathway abstractly without quantitative answer.,2,4,5,5,16,"Provides 18 reactions, substantially less than ideal's 58; describes pathway routes coherently but the core count is incorrect."
question_028,list,Which reviewed UniProt Bacillus subtilis (strain 168) proteins annotated with the biotin biosynthesis keyword have at least one deposited structure in the Protein Data Bank?,"Three of the seven reviewed Bacillus subtilis (strain 168, taxon:224308) proteins annotated with the biotin biosynthesis keyword (KW-0093) have at least one structure deposited in the Protein Data Bank, while four — BioB, BioD, BioF2, and BioF1 (kbl) — are structurally uncharacterized. The three with PDB entries correspond to enzymes of the B. subtilis-specific pimelate thioester synthesis route that differs fundamentally from the E. coli BioC/BioH pathway: BioW (BIOW_BACSU, P53559), the 6-carboxyhexanoate–CoA ligase that activates pimelate as its CoA thioester, has four deposited structures (including PDB:5G1F and substrate-bound complexes); BioK (BIOK_BACSU, P53555), the L-Lysine–8-amino-7-oxononanoate transaminase, has four structures (including PDB:3DOD); and BioI (BIOI_BACSU, P53554), the cytochrome P450 that oxidatively cleaves long-chain acyl-ACPs to generate the pimeloyl-ACP precursor, has three structures (including PDB:3EJB). Notably, BioB (BIOB_BACSU, P53557) — the radical SAM enzyme that inserts the sulfur atoms to form the biotin dithiolane ring, constituting the committed final step of biotin biosynthesis — lacks any deposited structure in UniProt's PDB cross-references, illustrating that structural characterization does not correlate simply with biochemical importance.",True,6.5,"I cannot provide a definitive answer to this question as it requires real-time access to integrated database queries across UniProt and the Protein Data Bank (PDB). To answer accurately, I would need to cross-reference the current UniProt entries for Bacillus subtilis strain 168 proteins that are both reviewed (Swiss-Prot quality) and annotated with the ""biotin biosynthesis"" keyword, then check which of these proteins have deposited three-dimensional structures in the PDB. This type of query requires direct database access to retrieve up-to-date information about protein annotations and structure availability, as these databases are continuously updated with new entries and revisions. While biotin biosynthesis in B. subtilis involves well-characterized enzymes such as BioA, BioB, BioD, BioF, and BioW, I cannot confirm without database verification which specific proteins from this pathway currently have both reviewed UniProt entries and PDB structures deposited.",344,214,0.004242,True,50.73,"Three reviewed UniProt Bacillus subtilis strain 168 proteins annotated with the biotin biosynthesis keyword have deposited structures in the Protein Data Bank. P53554, the biotin biosynthesis cytochrome P450 (P450BioI, EC 1.14.14.46), has three crystal structures (PDB entries 3eje, 3ejd, and 3ejb) showing complexes with fatty acid-ligated acyl carrier protein substrates. P53555, L-lysine--8-amino-7-oxononanoate transaminase (BioA, EC 2.6.1.105), also known as 7,8-diaminopelargonic acid aminotransferase, has four crystal structures (6wnn, 3du4, 3drd, and 3dod) including the apoenzyme, PLP-bound forms, and substrate-bound complexes. P53559, 6-carboxyhexanoate--CoA ligase (BioW, EC 6.2.1.14), which functions as pimeloyl-CoA synthase, has four crystal structures (5fll, 5g1f, 5flg, and 5fm0) showing various liganded states including complexes with pimeloyl-adenylate, coenzyme A, and AMPPNP. The remaining four proteins in the biotin biosynthesis pathway—8-amino-7-oxononanoate synthase 1 (O31777), 8-amino-7-oxononanoate synthase 2 (P53556), biotin synthase (P53557), and dethiobiotin synthetase (P53558)—currently lack deposited experimental structures in the PDB.",138,2502,0.09059455,0.094837,"ToolSearch, mcp__togomcp__search_uniprot_entity, mcp__togomcp__search_pdb_entity, mcp__togomcp__search_pdb_entity, mcp__togomcp__search_pdb_entity, mcp__togomcp__search_pdb_entity, mcp__togomcp__search_pdb_entity, mcp__togomcp__search_pdb_entity, mcp__togomcp__search_pdb_entity",1,3,4,4,12,Refuses to list the proteins; mentions general biotin biosynthesis enzymes but provides no PDB-confirmed list.,5,5,5,5,20,"Correctly identifies the three proteins (P53554, P53555, P53559) with their PDB entries; minor terminology difference (BioA vs BioK) but factually matches ideal."
question_029,summary,"Summarize the genomic and clinical variant landscape of the eight human Bardet-Biedl syndrome genes (BBS1, BBS2, BBS4, BBS5, BBS7, BBS9, BBS10, and BBS12) by their chromosomal distribution, total variant burden per gene in ClinVar, and the breakdown of clinical significance categories across all eight genes.","The eight canonical human Bardet-Biedl syndrome genes—BBS1, BBS2, BBS4, BBS5, BBS7, BBS9, BBS10, and BBS12—are distributed across seven distinct autosomes: chromosome 2 (BBS5), chromosome 4 (BBS7 and BBS12), chromosome 7 (BBS9), chromosome 11 (BBS1), chromosome 12 (BBS10), chromosome 15 (BBS4), and chromosome 16 (BBS2), making chromosome 4 the only chromosome harboring two of these genes. In the MeSH hierarchy, Bardet-Biedl syndrome (D020788) is classified simultaneously under congenital and hereditary ciliopathies (tree C16.131.077.245.125 and C16.320.184.125), retinitis pigmentosa within eye diseases (C11.270.684.624), and hypothalamic diseases (C10.228.140.617.200), reflecting the multi-system pathology of this ciliopathy. Together the eight genes harbor 7,800 distinct current ClinVar variants; BBS9 (1,283 variants) and BBS2 (1,258) carry the heaviest burdens, followed by BBS1 (1,193), BBS10 (1,007), BBS4 (900), BBS12 (868), BBS7 (849), and BBS5 (465, the lightest burden). By variant type, single nucleotide variants overwhelmingly dominate at 6,468 (83%), followed by deletions (666; 8.5%) and duplications (274; 3.5%). For clinical significance across all eight genes, the largest category is likely benign (2,808 variants), followed by variants of uncertain significance at 2,759, while pathogenic, likely pathogenic, and combined pathogenic/likely pathogenic entries total 1,638; 23 variants are counted in two BBS genes simultaneously, reflecting structural variants on chromosome 4 that overlap both BBS7 and BBS12.
",True,10.13,"The eight human Bardet-Biedl syndrome genes are distributed across six chromosomes: BBS1 on chromosome 11q13.2, BBS2 on 16q13.1, BBS4 on 15q24.1, BBS5 on 2q31.1, BBS7 on 4q27, BBS9 on 7p14.3, BBS10 on 12q21.2, and BBS12 on 4q27. Based on ClinVar data, these genes demonstrate substantial variant burdens, with BBS1 typically harboring the highest number of reported variants (over 300), followed by BBS10 (approximately 200-250 variants), while BBS2, BBS4, BBS7, BBS9, and BBS12 each contain 100-200 variants, and BBS5 generally shows the lowest burden with fewer than 100 reported variants. The clinical significance categories across these eight genes reveal that pathogenic and likely pathogenic variants collectively represent the largest proportion (approximately 40-50% of total variants), reflecting the well-characterized disease-causing nature of mutations in these genes. Variants of uncertain significance (VUS) constitute a substantial portion (approximately 30-40%), highlighting ongoing challenges in variant interpretation for this genetically heterogeneous ciliopathy. Benign and likely benign variants account for roughly 15-25% of reported variants, while conflicting interpretations of pathogenicity represent a smaller fraction (typically 5-10%). The M390R variant in BBS1 stands out as the most common pathogenic allele, particularly in populations of European ancestry, and exemplifies the role of founder mutations in BBS genetics.",390,382,0.0069,True,120.58,"The eight human Bardet-Biedl syndrome genes are distributed across seven chromosomes: BBS1 on 11q13.2, BBS2 on 16q13, BBS4 on 15q24.1, BBS5 on 2q31.1, BBS7 on 4q27, BBS9 on 7p14.3, BBS10 on 12q21.2, and BBS12 on 4q27 (notably, both BBS7 and BBS12 map to the same chromosomal region). ClinVar documents 8,379 total variants across these eight genes, with BBS2 harboring the highest variant burden at 1,394 variants, followed by BBS9 (1,342), BBS1 (1,265), BBS10 (1,088), BBS4 (975), BBS12 (928), BBS7 (892), and BBS5 (495). The clinical significance distribution across all eight genes reveals 2,039 pathogenic variants (24%), 4,405 benign variants (53%), and 1,935 variants (23%) classified as likely pathogenic, likely benign, uncertain significance, or having conflicting interpretations, reflecting the diagnostic complexity of this genetically heterogeneous ciliopathy syndrome.",553,7146,0.6500712,0.656971,"ToolSearch, mcp__togomcp__ncbi_esearch, mcp__togomcp__ncbi_esearch, mcp__togomcp__ncbi_esearch, mcp__togomcp__ncbi_esearch, mcp__togomcp__ncbi_esearch, mcp__togomcp__ncbi_esearch, mcp__togomcp__ncbi_esearch, mcp__togomcp__ncbi_esearch, mcp__togomcp__ncbi_esummary, mcp__togomcp__ncbi_esearch, mcp__togomcp__ncbi_esearch, mcp__togomcp__ncbi_esearch, mcp__togomcp__ncbi_esearch, mcp__togomcp__ncbi_esearch, mcp__togomcp__ncbi_esearch, mcp__togomcp__ncbi_esearch, mcp__togomcp__ncbi_esearch, mcp__togomcp__ncbi_esearch, mcp__togomcp__ncbi_esearch, mcp__togomcp__ncbi_esearch, mcp__togomcp__ncbi_esearch, mcp__togomcp__ncbi_esearch, mcp__togomcp__ncbi_esearch, mcp__togomcp__ncbi_esearch, mcp__togomcp__ncbi_esearch, mcp__togomcp__ncbi_esearch, mcp__togomcp__ncbi_esearch, mcp__togomcp__ncbi_esearch, mcp__togomcp__ncbi_esearch, mcp__togomcp__ncbi_esearch, mcp__togomcp__ncbi_esummary, mcp__togomcp__ncbi_esearch, mcp__togomcp__ncbi_esearch, mcp__togomcp__ncbi_esearch, mcp__togomcp__ncbi_esearch, mcp__togomcp__ncbi_esearch, mcp__togomcp__ncbi_esearch, mcp__togomcp__ncbi_esearch, mcp__togomcp__ncbi_esearch, mcp__togomcp__ncbi_esearch, mcp__togomcp__ncbi_esearch, mcp__togomcp__ncbi_esearch, mcp__togomcp__ncbi_esearch, mcp__togomcp__ncbi_esearch, mcp__togomcp__ncbi_esearch",2,3,4,4,13,Correctly identifies the 8 genes' chromosomes but undercounts variants by an order of magnitude (300 vs 1193 for BBS1) and miscounts unique chromosomes (6 vs 7); clinical significance percentages are speculative.,4,5,4,5,18,Provides accurate 7-chromosome distribution and total variant burden close to ideal (8379 vs 7800); BBS2/BBS9 ranking is reversed but counts are plausible. Clinical significance breakdown is approximate.
